{
  "schema_id": "gait.pack.diff",
  "schema_version": "1.0.0",
  "created_at": "2026-02-14T00:00:00Z",
  "left_pack_id": "1111111111111111111111111111111111111111111111111111111111111111",
  "right_pack_id": "2222222222222222222222222222222222222222222222222222222222222222",
  "left_pack_type": "run",
  "right_pack_type": "run",
  "summary": {
    "changed": true,
    "added_files": ["job_payload.json"],
    "removed_files": ["run_payload.json"],
    "changed_files": ["pack_manifest.json"],
    "manifest_delta": true
  }
}
